{
  "schemaVersion": 2,
  "id": "skill-terraform",
  "name": "Terraform",
  "version": "1.0.0",
  "description": "Terraform engineering for module boundaries, state, providers, plans, drift, imports, secrets, and safe infrastructure changes.",
  "author": {
    "name": "Chainabit"
  },
  "license": "Apache-2.0",
  "homepage": "https://github.com/chainabit/plugins.git/tree/main/infrastructure/skill-terraform",
  "categories": [
    "code",
    "infrastructure"
  ],
  "keywords": [
    "terraform",
    "iac",
    "state",
    "providers"
  ],
  "compatibility": {
    "minVersion": "0.9.0"
  },
  "components": {
    "skills": [
      "skills/terraform"
    ]
  },
  "composition": {
    "requires": [
      "skill-software-engineering"
    ],
    "role": "specialist"
  },
  "permissions": {
    "network": [],
    "filesystem": [],
    "shell": false,
    "execute": false,
    "dangerousSkipPermissions": false
  }
}
