{
  "schemaVersion": 2,
  "id": "skill-express",
  "name": "Express",
  "version": "1.0.0",
  "description": "Express engineering for middleware composition, routing, validation, error boundaries, security headers, and testable Node services.",
  "author": {
    "name": "Chainabit"
  },
  "license": "Apache-2.0",
  "homepage": "https://github.com/chainabit/plugins.git/tree/main/frameworks/skill-express",
  "categories": [
    "code"
  ],
  "keywords": [
    "express",
    "node",
    "middleware",
    "http"
  ],
  "compatibility": {
    "minVersion": "0.9.0"
  },
  "components": {
    "skills": [
      "skills/express"
    ]
  },
  "composition": {
    "requires": [
      "skill-software-engineering"
    ],
    "role": "framework"
  },
  "permissions": {
    "network": [],
    "filesystem": [],
    "shell": false,
    "execute": false,
    "dangerousSkipPermissions": false
  }
}
