{
  "schemaVersion": 2,
  "id": "skill-php",
  "name": "PHP",
  "version": "1.0.0",
  "description": "Modern PHP engineering for Composer packages, strict types, namespaces, errors, security, and maintainable services.",
  "author": {
    "name": "Chainabit"
  },
  "license": "Apache-2.0",
  "homepage": "https://github.com/chainabit/plugins.git/tree/main/languages/skill-php",
  "categories": [
    "code"
  ],
  "keywords": [
    "php",
    "composer",
    "psr",
    "php-fpm"
  ],
  "compatibility": {
    "minVersion": "0.9.0"
  },
  "components": {
    "skills": [
      "skills/php"
    ]
  },
  "composition": {
    "requires": [
      "skill-software-engineering"
    ],
    "role": "language"
  },
  "permissions": {
    "network": [],
    "filesystem": [],
    "shell": false,
    "execute": false,
    "dangerousSkipPermissions": false,
    "permissionModelVersion": 2,
    "requested": []
  }
}
