{
  "schemaVersion": 2,
  "id": "skill-ansible",
  "name": "Ansible",
  "version": "1.0.0",
  "description": "Ansible engineering for inventory boundaries, idempotent tasks, handlers, secrets, check mode, and convergent configuration.",
  "author": {
    "name": "Chainabit"
  },
  "license": "Apache-2.0",
  "homepage": "https://github.com/chainabit/plugins.git/tree/main/infrastructure/skill-ansible",
  "categories": [
    "code",
    "infrastructure"
  ],
  "keywords": [
    "ansible",
    "configuration-management",
    "idempotent"
  ],
  "compatibility": {
    "minVersion": "0.9.0"
  },
  "components": {
    "skills": [
      "skills/ansible"
    ]
  },
  "composition": {
    "requires": [
      "skill-software-engineering"
    ],
    "role": "specialist"
  },
  "permissions": {
    "network": [],
    "filesystem": [],
    "shell": false,
    "execute": false,
    "dangerousSkipPermissions": false
  }
}
