{
  "schemaVersion": 2,
  "id": "skill-rust",
  "name": "Rust",
  "version": "1.0.0",
  "description": "Rust engineering for ownership, lifetimes, traits, async runtimes, crates, and safe systems performance.",
  "author": {
    "name": "Chainabit"
  },
  "license": "Apache-2.0",
  "homepage": "https://github.com/chainabit/plugins.git/tree/main/languages/skill-rust",
  "categories": [
    "code"
  ],
  "keywords": [
    "rust",
    "cargo",
    "ownership",
    "tokio"
  ],
  "compatibility": {
    "minVersion": "0.9.0"
  },
  "components": {
    "skills": [
      "skills/rust"
    ]
  },
  "composition": {
    "requires": [
      "skill-software-engineering"
    ],
    "role": "language"
  },
  "permissions": {
    "network": [],
    "filesystem": [],
    "shell": false,
    "execute": false,
    "dangerousSkipPermissions": false
  }
}
