{
  "schemaVersion": 2,
  "id": "skill-graphql",
  "name": "GraphQL",
  "version": "1.0.0",
  "description": "GraphQL engineering for schema ownership, resolver boundaries, authorization, N+1 control, evolution, and contract testing.",
  "author": {
    "name": "Chainabit"
  },
  "license": "Apache-2.0",
  "homepage": "https://github.com/chainabit/plugins.git/tree/main/web/skill-graphql",
  "categories": [
    "code"
  ],
  "keywords": [
    "graphql",
    "schema",
    "resolvers",
    "federation"
  ],
  "compatibility": {
    "minVersion": "0.9.0"
  },
  "components": {
    "skills": [
      "skills/graphql"
    ]
  },
  "composition": {
    "requires": [
      "skill-software-engineering"
    ],
    "role": "specialist"
  },
  "permissions": {
    "network": [],
    "filesystem": [],
    "shell": false,
    "execute": false,
    "dangerousSkipPermissions": false,
    "permissionModelVersion": 2,
    "requested": []
  }
}
