{
  "schemaVersion": 2,
  "id": "skill-elixir",
  "name": "Elixir",
  "version": "1.0.0",
  "description": "Elixir engineering for OTP supervision, processes, pattern matching, Mix, fault isolation, and observable services.",
  "author": {
    "name": "Chainabit"
  },
  "license": "Apache-2.0",
  "homepage": "https://github.com/chainabit/plugins.git/tree/main/languages/skill-elixir",
  "categories": [
    "code"
  ],
  "keywords": [
    "elixir",
    "otp",
    "supervision",
    "beam"
  ],
  "compatibility": {
    "minVersion": "0.9.0"
  },
  "components": {
    "skills": [
      "skills/elixir"
    ]
  },
  "composition": {
    "requires": [
      "skill-software-engineering"
    ],
    "role": "language"
  },
  "permissions": {
    "network": [],
    "filesystem": [],
    "shell": false,
    "execute": false,
    "dangerousSkipPermissions": false
  }
}
