{
  "schemaVersion": 2,
  "id": "skill-test-strategy",
  "name": "Test Strategy",
  "version": "1.0.0",
  "description": "Test strategy for risk-based coverage, test boundaries, fixtures, failure paths, determinism, and useful feedback loops.",
  "author": {
    "name": "Chainabit"
  },
  "license": "Apache-2.0",
  "homepage": "https://github.com/chainabit/plugins.git/tree/main/testing/skill-test-strategy",
  "categories": [
    "code",
    "testing"
  ],
  "keywords": [
    "testing",
    "strategy",
    "coverage",
    "fixtures"
  ],
  "compatibility": {
    "minVersion": "0.9.0"
  },
  "components": {
    "skills": [
      "skills/test-strategy"
    ]
  },
  "composition": {
    "requires": [
      "skill-software-engineering"
    ],
    "role": "specialist"
  },
  "permissions": {
    "network": [],
    "filesystem": [],
    "shell": false,
    "execute": false,
    "dangerousSkipPermissions": false
  }
}
