{
  "schemaVersion": 2,
  "id": "skill-actix",
  "name": "Actix Web",
  "version": "1.0.0",
  "description": "Actix Web engineering for Rust extractors, actors, async state, error responses, middleware, and safe high-performance APIs.",
  "author": {
    "name": "Chainabit"
  },
  "license": "Apache-2.0",
  "homepage": "https://github.com/chainabit/plugins.git/tree/main/frameworks/skill-actix",
  "categories": [
    "code"
  ],
  "keywords": [
    "actix-web",
    "rust",
    "async",
    "extractors"
  ],
  "compatibility": {
    "minVersion": "0.9.0"
  },
  "components": {
    "skills": [
      "skills/actix"
    ]
  },
  "composition": {
    "requires": [
      "skill-software-engineering"
    ],
    "role": "framework"
  },
  "permissions": {
    "network": [],
    "filesystem": [],
    "shell": false,
    "execute": false,
    "dangerousSkipPermissions": false
  }
}
