{
  "schemaVersion": 2,
  "id": "skill-nuxt",
  "name": "Nuxt",
  "version": "1.0.0",
  "description": "Nuxt engineering for composables, server routes, rendering modes, modules, runtime config, and deploy-safe Vue applications.",
  "author": {
    "name": "Chainabit"
  },
  "license": "Apache-2.0",
  "homepage": "https://github.com/chainabit/plugins.git/tree/main/frameworks/skill-nuxt",
  "categories": [
    "code"
  ],
  "keywords": [
    "nuxt",
    "vue",
    "nitro",
    "ssr"
  ],
  "compatibility": {
    "minVersion": "0.9.0"
  },
  "components": {
    "skills": [
      "skills/nuxt"
    ]
  },
  "composition": {
    "requires": [
      "skill-software-engineering"
    ],
    "role": "framework"
  },
  "permissions": {
    "network": [],
    "filesystem": [],
    "shell": false,
    "execute": false,
    "dangerousSkipPermissions": false
  }
}
