{
  "schemaVersion": 2,
  "id": "skill-csharp",
  "name": "C#",
  "version": "1.0.0",
  "description": "C# engineering for .NET project structure, nullable types, async code, dependency injection, testing, and runtime behavior.",
  "author": {
    "name": "Chainabit"
  },
  "license": "Apache-2.0",
  "homepage": "https://github.com/chainabit/plugins.git/tree/main/languages/skill-csharp",
  "categories": [
    "code"
  ],
  "keywords": [
    "c-sharp",
    "dotnet",
    "nullable",
    "async"
  ],
  "compatibility": {
    "minVersion": "0.9.0"
  },
  "components": {
    "skills": [
      "skills/csharp"
    ]
  },
  "composition": {
    "requires": [
      "skill-software-engineering"
    ],
    "role": "language"
  },
  "permissions": {
    "network": [],
    "filesystem": [],
    "shell": false,
    "execute": false,
    "dangerousSkipPermissions": false
  }
}
