{
  "schemaVersion": 2,
  "id": "skill-concurrency",
  "name": "Concurrency",
  "version": "1.0.0",
  "description": "Concurrency engineering for shared state, synchronization, cancellation, deadlocks, starvation, and deterministic tests.",
  "author": {
    "name": "Chainabit"
  },
  "license": "Apache-2.0",
  "homepage": "https://github.com/chainabit/plugins.git/tree/main/foundations/skill-concurrency",
  "categories": [
    "code",
    "foundations"
  ],
  "keywords": [
    "concurrency",
    "races",
    "deadlocks",
    "cancellation"
  ],
  "compatibility": {
    "minVersion": "0.9.0"
  },
  "components": {
    "skills": [
      "skills/concurrency"
    ]
  },
  "composition": {
    "requires": [
      "skill-software-engineering"
    ],
    "role": "specialist"
  },
  "permissions": {
    "network": [],
    "filesystem": [],
    "shell": false,
    "execute": false,
    "dangerousSkipPermissions": false,
    "permissionModelVersion": 2,
    "requested": []
  }
}
