{
  "schemaVersion": 2,
  "id": "skill-axum",
  "name": "Axum",
  "version": "1.0.0",
  "description": "Axum engineering for Rust routers, extractors, Tower layers, state, error typing, and observable async services.",
  "author": {
    "name": "Chainabit"
  },
  "license": "Apache-2.0",
  "homepage": "https://github.com/chainabit/plugins.git/tree/main/frameworks/skill-axum",
  "categories": [
    "code"
  ],
  "keywords": [
    "axum",
    "rust",
    "tower",
    "tokio"
  ],
  "compatibility": {
    "minVersion": "0.9.0"
  },
  "components": {
    "skills": [
      "skills/axum"
    ]
  },
  "composition": {
    "requires": [
      "skill-software-engineering"
    ],
    "role": "framework"
  },
  "permissions": {
    "network": [],
    "filesystem": [],
    "shell": false,
    "execute": false,
    "dangerousSkipPermissions": false
  }
}
